{
  "id": "A-12",
  "name": "Residence",
  "elevationImage": "/data/buildings/A-12/elevation.jpeg",
  "floors": [
    {
      "id": "floor-1",
      "number": 1,
      "elevationPolygons": [
        [
          489.1387719565455,
          741.2321707471835,
          489.6527524550477,
          543.2062663671483,
          1761.6552275994668,
          534.2125224328161,
          1762.0518860166405,
          724.030254763865
        ]
      ]
    },
    {
      "id": "floor-0",
      "number": 0,
      "elevationPolygons": [
        [
          299.93674171320697,
          999.4467248172203,
          295.39111962784153,
          743.755482515415,
          1761.354242158192,
          725.5729941739534,
          1764.763458722216,
          996.0375082531963
        ]
      ]
    }
  ]
}