{
  "id": "B-11",
  "name": "North Tower",
  "elevationImage": "/data/buildings/B-11/elevation.jpeg",
  "floors": [
    {
      "id": "floor-3",
      "number": 3,
      "elevationPolygons": [
        [
          421.27831512128716,
          183.8343441929328,
          484.17348468909563,
          182.61701833033007,
          484.98503526416414,
          150.9665459026587,
          758.8833543497815,
          150.56077061512448,
          766.187309525398,
          176.9361643048506,
          898.0642779740285,
          175.31306315471363,
          897.6585026864943,
          148.9376694649875,
          1085.9382361023854,
          148.9376694649875,
          1085.9382361023854,
          174.50151257964512,
          1255.146531004167,
          174.90728786717938,
          1265.290913192523,
          148.12611888991898,
          1502.0463552499211,
          146.49146716471353,
          1502.2752316875924,
          179.16504074252185,
          1563.9415248177297,
          179.3708160300561,
          1564.9530753927982,
          354.3502344941663,
          421.2889935997042,
          358.157547548715
        ]
      ]
    },
    {
      "id": "floor-2",
      "number": 2,
      "elevationPolygons": [
        [
          420.23265827140034,
          562.864775376383,
          421.30757993067266,
          358.2282960116116,
          1564.7194152487102,
          354.27458980373456,
          1563.3286740071346,
          559.7969352312846
        ]
      ]
    },
    {
      "id": "floor-1",
      "number": 1,
      "elevationPolygons": [
        [
          417.61797049079627,
          795.5687942823674,
          421.2492099349363,
          563.6882183494272,
          1563.014640870957,
          560.5757273973071,
          1563.014640870957,
          796.0875427743874,
          1523.8834738098572,
          812.1375065828673,
          460.3428800119962,
          811.9000095988273
        ]
      ]
    },
    {
      "id": "floor-0",
      "number": 0,
      "elevationPolygons": [
        [
          460.86447958558665,
          1008.2716744921956,
          460.15504939455496,
          811.9715203828248,
          1524.014811068001,
          812.1905454545712,
          1525.0937878115697,
          1010.6148672314373
        ]
      ]
    }
  ]
}